{
  "$schema": "https://json-schema.org/draft/2020-12/schema",
  "title": "PF Compare Report",
  "description": "Comparison report between a PatternFly component and its PatternFly Java implementation.",
  "type": "object",
  "required": ["skillVersion", "component", "date", "pfVersion", "pfUrl", "pfjUrl", "sections", "variations", "actionItems"],
  "properties": {
    "skillVersion": {
      "type": "string",
      "description": "Version of the pf-compare skill that generated this report (from SKILL.md metadata.version)"
    },
    "component": {
      "type": "string",
      "description": "Component URL slug (e.g., 'button', 'data-list')"
    },
    "date": {
      "type": "string",
      "format": "date",
      "description": "Report generation date (YYYY-MM-DD)"
    },
    "pfVersion": {
      "type": "string",
      "description": "PatternFly version detected from the PF site (e.g., 'Release 6.5.1')"
    },
    "pfUrl": {
      "type": "string",
      "format": "uri",
      "description": "PF React showcase URL (e.g., https://www.patternfly.org/components/button)"
    },
    "pfjUrl": {
      "type": "string",
      "format": "uri",
      "description": "PFJ showcase URL (e.g., http://localhost:1234/components/button)"
    },
    "sections": {
      "type": "object",
      "description": "Section coverage summary",
      "required": ["pfCount", "pfjCount", "matched", "missingInPfj", "extraInPfj"],
      "properties": {
        "pfCount": { "type": "integer", "description": "Number of example sections in PF" },
        "pfjCount": { "type": "integer", "description": "Number of example sections in PFJ" },
        "matched": { "type": "integer", "description": "Number of matched section pairs" },
        "missingInPfj": {
          "type": "array",
          "items": { "type": "string" },
          "description": "PF section titles with no PFJ counterpart"
        },
        "extraInPfj": {
          "type": "array",
          "items": { "type": "string" },
          "description": "PFJ section titles with no PF counterpart"
        }
      }
    },
    "variations": {
      "type": "array",
      "description": "PF section data with raw HTML (consumed by pf-align for reference HTML)",
      "items": {
        "type": "object",
        "required": ["slug", "title", "html"],
        "properties": {
          "slug": { "type": "string", "description": "Section URL slug from heading ID" },
          "title": { "type": "string", "description": "Section heading title" },
          "html": { "type": "string", "description": "Raw innerHTML of the PF preview container" }
        }
      }
    },
    "actionItems": {
      "type": "array",
      "description": "Prioritized list of differences to address",
      "items": {
        "type": "object",
        "required": ["number", "type", "priority", "title", "description"],
        "properties": {
          "number": { "type": "integer", "description": "Sequential action item number" },
          "type": {
            "type": "string",
            "enum": ["add_variation", "fix_css", "fix_structure", "fix_attribute", "fix_icon", "implement_feature"],
            "description": "Type of action required"
          },
          "priority": {
            "type": "string",
            "enum": ["P1", "P2", "P3", "P4", "P5"],
            "description": "P1=missing elements, P2=modifiers, P3=attributes, P4=icons, P5=cosmetic"
          },
          "title": { "type": "string", "description": "Short title identifying the target" },
          "description": { "type": "string", "description": "What needs to be done and why" },
          "category": {
            "type": "string",
            "enum": ["missing_sections", "dom_differences", "feature_implementation"],
            "description": "Grouping category"
          },
          "variations": {
            "type": "array",
            "items": { "type": "string" },
            "description": "Section titles affected by this action item"
          }
        }
      }
    }
  }
}
