{
  "skillVersion": "0.2.0",
  "component": "button",
  "date": "2026-06-08",
  "pfVersion": "Release 6.5.1",
  "pfUrl": "https://www.patternfly.org/components/button",
  "pfjUrl": "http://localhost:1234/components/button",
  "sections": {
    "pfCount": 17,
    "pfjCount": 18,
    "matched": 16,
    "missingInPfj": [
      "Custom component"
    ],
    "extraInPfj": [
      "Clicked buttons",
      "Types"
    ]
  },
  "variations": [
    {
      "slug": "variant-examples",
      "title": "Variant examples",
      "html": "<div class=\"pf-v6-l-flex pf-m-column-gap-sm\"><button class=\"pf-v6-c-button pf-m-primary\" type=\"button\" data-ouia-component-type=\"PF6/Button\" data-ouia-safe=\"true\" data-ouia-component-id=\"Primary\"><span class=\"pf-v6-c-button__text\"> Primary </span></button><button class=\"pf-v6-c-button pf-m-secondary\" type=\"button\" data-ouia-component-type=\"PF6/Button\" data-ouia-safe=\"true\" data-ouia-component-id=\"Secondary\"><span class=\"pf-v6-c-button__text\"> Secondary </span></button><button class=\"pf-v6-c-button pf-m-secondary pf-m-danger\" type=\"button\" data-ouia-component-type=\"PF6/Button\" data-ouia-safe=\"true\" data-ouia-component-id=\"DangerSecondary\"><span class=\"pf-v6-c-button__text\"> Danger Secondary </span></button><button class=\"pf-v6-c-button pf-m-tertiary\" type=\"button\" data-ouia-component-type=\"PF6/Button\" data-ouia-safe=\"true\" data-ouia-component-id=\"Tertiary\"><span class=\"pf-v6-c-button__text\"> Tertiary </span></button><button class=\"pf-v6-c-button pf-m-danger\" type=\"button\" data-ouia-component-type=\"PF6/Button\" data-ouia-safe=\"true\" data-ouia-component-id=\"Danger\"><span class=\"pf-v6-c-button__text\"> Danger </span></button><button class=\"pf-v6-c-button pf-m-warning\" type=\"button\" data-ouia-component-type=\"PF6/Button\" data-ouia-safe=\"true\" data-ouia-component-id=\"Warning\"><span class=\"pf-v6-c-button__text\"> Warning </span></button></div><br><div class=\"pf-v6-l-flex pf-m-column-gap-sm\"><button class=\"pf-v6-c-button pf-m-link\" type=\"button\" data-ouia-component-type=\"PF6/Button\" data-ouia-safe=\"true\" data-ouia-component-id=\"OUIA-Generated-Button-link-:r3n:\"><span class=\"pf-v6-c-button__icon pf-m-start\"><svg class=\"pf-v6-svg\" fill=\"currentColor\" viewBox=\"0 0 32 32\" aria-hidden=\"true\" role=\"img\" width=\"1em\" height=\"1em\"><path d=\"M16 1C7.729 1 1 7.729 1 16s6.729 15 15 15 15-6.729 15-15S24.271 1 16 1Zm7 16.125h-5.875V23a1.125 1.125 0 0 1-2.25 0v-5.875H9a1.125 1.125 0 0 1 0-2.25h5.875V9a1.125 1.125 0 0 1 2.25 0v5.875H23a1.125 1.125 0 0 1 0 2.25Z\"></path></svg></span><span class=\"pf-v6-c-button__text\"> Link </span></button><button class=\"pf-v6-c-button pf-m-link\" type=\"button\" data-ouia-component-type=\"PF6/Button\" data-ouia-safe=\"true\" data-ouia-component-id=\"OUIA-Generated-Button-link-:r3o:\"><span class=\"pf-v6-c-button__text\"> Link </span><span class=\"pf-v6-c-button__icon pf-m-end\"><svg class=\"pf-v6-svg\" fill=\"currentColor\" viewBox=\"0 0 32 32\" aria-hidden=\"true\" role=\"img\" width=\"1em\" height=\"1em\"><path d=\"M28.5 2h-25C2.673 2 2 2.673 2 3.5v25c0 .827.673 1.5 1.5 1.5h25c.827 0 1.5-.673 1.5-1.5v-25c0-.827-.673-1.5-1.5-1.5Zm-3.375 17a1.125 1.125 0 0 1-2.25 0v-8.284L11.796 21.795a1.122 1.122 0 0 1-1.592 0 1.127 1.127 0 0 1 0-1.591l11.08-11.08H13a1.125 1.125 0 0 1 0-2.25h10.5c.896 0 1.625.729 1.625 1.625v10.5Z\"></path></svg></span></button><button class=\"pf-v6-c-button pf-m-link pf-m-inline\" type=\"button\" data-ouia-component-type=\"PF6/Button\" data-ouia-safe=\"true\" data-ouia-component-id=\"OUIA-Generated-Button-link-:r3p:\"><span class=\"pf-v6-c-button__text\"> Inline link </span></button><button class=\"pf-v6-c-button pf-m-link pf-m-danger\" type=\"button\" data-ouia-component-type=\"PF6/Button\" data-ouia-safe=\"true\" data-ouia-component-id=\"OUIA-Generated-Button-link-:r3q:\"><span class=\"pf-v6-c-button__text\"> Danger link </span></button><button aria-label=\"Action\" class=\"pf-v6-c-button pf-m-plain\" type=\"button\" data-ouia-component-type=\"PF6/Button\" data-ouia-safe=\"true\" data-ouia-component-id=\"OUIA-Generated-Button-plain-:r3r:\"><span class=\"pf-v6-c-button__icon\"><svg class=\"pf-v6-svg\" fill=\"currentColor\" viewBox=\"0 0 20 20\" aria-hidden=\"true\" role=\"img\" width=\"1em\" height=\"1em\"><path d=\"M17.8 16.2 11.59 10l6.21-6.21c.42-.46.39-1.17-.07-1.59-.43-.4-1.09-.4-1.52 0l-6.2 6.2-6.22-6.19c-.44-.44-1.15-.44-1.59 0-.44.44-.44 1.15 0 1.59l6.2 6.21-6.2 6.2c-.42.46-.39 1.17.07 1.59.43.4 1.09.4 1.52 0L10 11.59l6.2 6.2c.44.44 1.15.44 1.59 0 .44-.45.44-1.16 0-1.6Z\"></path></svg></span></button></div><br><div class=\"pf-v6-l-flex pf-m-column-gap-sm\"><button class=\"pf-v6-c-button pf-m-control\" type=\"button\" data-ouia-component-type=\"PF6/Button\" data-ouia-safe=\"true\" data-ouia-component-id=\"OUIA-Generated-Button-control-:r3s:\"><span class=\"pf-v6-c-button__text\">Control</span></button><button aria-label=\"Copy\" class=\"pf-v6-c-button pf-m-control\" type=\"button\" data-ouia-component-type=\"PF6/Button\" data-ouia-safe=\"true\" data-ouia-component-id=\"OUIA-Generated-Button-control-:r3t:\"><span class=\"pf-v6-c-button__icon\"><svg class=\"pf-v6-svg\" fill=\"currentColor\" aria-hidden=\"true\" role=\"img\" width=\"1em\" height=\"1em\"><svg viewBox=\"0 0 448 512\" class=\"pf-v6-icon-default\"><path d=\"M320 448v40c0 13.255-10.745 24-24 24H24c-13.255 0-24-10.745-24-24V120c0-13.255 10.745-24 24-24h72v296c0 30.879 25.121 56 56 56h168zm0-344V0H152c-13.255 0-24 10.745-24 24v368c0 13.255 10.745 24 24 24h272c13.255 0 24-10.745 24-24V128H344c-13.2 0-24-10.8-24-24zm120.971-31.029L375.029 7.029A24 24 0 0 0 358.059 0H352v96h96v-6.059a24 24 0 0 0-7.029-16.97z\"></path></svg><svg viewBox=\"0 0 32 32\" class=\"pf-v6-icon-rh-ui\"><path d=\"M28 7v22.607c0 .768-.622 1.393-1.387 1.393H10a1 1 0 1 1 0-2h16V7a1 1 0 1 1 2 0Zm-6.5 19h-16c-.827 0-1.5-.673-1.5-1.5V8a1.001 1.001 0 0 1 .294-.708l5.998-5.998A1.001 1.001 0 0 1 11 1h10.5c.827 0 1.5.673 1.5 1.5v22c0 .827-.673 1.5-1.5 1.5ZM7.414 7H10V4.414L7.414 7ZM21 3h-9v4.614C12 8.378 11.378 9 10.613 9H6v15h15V3Z\"></path></svg></svg></span></button></div><br><div class=\"pf-v6-l-flex pf-m-column-gap-sm\"><button class=\"pf-v6-c-button pf-m-stateful pf-m-read\" type=\"button\" data-ouia-component-type=\"PF6/Button\" data-ouia-safe=\"true\" data-ouia-component-id=\"OUIA-Generated-Button-stateful-:r3u:\"><span class=\"pf-v6-c-button__icon pf-m-start\"><svg class=\"pf-v6-svg\" fill=\"currentColor\" viewBox=\"0 0 32 32\" aria-hidden=\"true\" role=\"img\" width=\"1em\" height=\"1em\"><path d=\"M28.75 22v3.5c0 .689-.561 1.25-1.25 1.25h-7.521c.005.084.021.166.021.25 0 2.206-1.794 4-4 4s-4-1.794-4-4c0-.084.016-.166.021-.25H4.5c-.689 0-1.25-.561-1.25-1.25V22a.75.75 0 0 1 .75-.75c1.24 0 2.25-1.009 2.25-2.25v-4c0-4.826 3.528-8.833 8.138-9.605A2.482 2.482 0 0 1 13.5 3.5C13.5 2.122 14.621 1 16 1s2.5 1.122 2.5 2.5c0 .761-.349 1.436-.888 1.895 4.61.772 8.138 4.779 8.138 9.605v4c0 1.241 1.01 2.25 2.25 2.25a.75.75 0 0 1 .75.75Z\"></path></svg></span><span class=\"pf-v6-c-button__text\"> Stateful read </span></button><button class=\"pf-v6-c-button pf-m-stateful pf-m-unread\" type=\"button\" data-ouia-component-type=\"PF6/Button\" data-ouia-safe=\"true\" data-ouia-component-id=\"OUIA-Generated-Button-stateful-:r3v:\"><span class=\"pf-v6-c-button__icon pf-m-start\"><svg class=\"pf-v6-svg\" fill=\"currentColor\" viewBox=\"0 0 32 32\" aria-hidden=\"true\" role=\"img\" width=\"1em\" height=\"1em\"><path d=\"M28.75 22v3.5c0 .689-.561 1.25-1.25 1.25h-7.521c.005.084.021.166.021.25 0 2.206-1.794 4-4 4s-4-1.794-4-4c0-.084.016-.166.021-.25H4.5c-.689 0-1.25-.561-1.25-1.25V22a.75.75 0 0 1 .75-.75c1.24 0 2.25-1.009 2.25-2.25v-4c0-4.826 3.528-8.833 8.138-9.605A2.482 2.482 0 0 1 13.5 3.5C13.5 2.122 14.621 1 16 1s2.5 1.122 2.5 2.5c0 .761-.349 1.436-.888 1.895 4.61.772 8.138 4.779 8.138 9.605v4c0 1.241 1.01 2.25 2.25 2.25a.75.75 0 0 1 .75.75Z\"></path></svg></span><span class=\"pf-v6-c-button__text\"> Stateful unread </span></button><button class=\"pf-v6-c-button pf-m-stateful pf-m-attention\" type=\"button\" data-ouia-component-type=\"PF6/Button\" data-ouia-safe=\"true\" data-ouia-component-id=\"OUIA-Generated-Button-stateful-:r40:\"><span class=\"pf-v6-c-button__icon pf-m-start\"><svg class=\"pf-v6-svg\" fill=\"currentColor\" viewBox=\"0 0 32 32\" aria-hidden=\"true\" role=\"img\" width=\"1em\" height=\"1em\"><path d=\"M28.75 22v3.5c0 .689-.561 1.25-1.25 1.25h-7.521c.005.084.021.166.021.25 0 2.206-1.794 4-4 4s-4-1.794-4-4c0-.084.016-.166.021-.25H4.5c-.689 0-1.25-.561-1.25-1.25V22a.75.75 0 0 1 .75-.75c1.24 0 2.25-1.009 2.25-2.25v-4c0-4.826 3.528-8.833 8.138-9.605A2.482 2.482 0 0 1 13.5 3.5C13.5 2.122 14.621 1 16 1s2.5 1.122 2.5 2.5c0 .761-.349 1.436-.888 1.895 4.61.772 8.138 4.779 8.138 9.605v4c0 1.241 1.01 2.25 2.25 2.25a.75.75 0 0 1 .75.75Z\"></path></svg></span><span class=\"pf-v6-c-button__text\"> Stateful attention </span></button></div>"
    },
    {
      "slug": "disabled-buttons",
      "title": "Disabled buttons",